{
  "schemaVersion": 1,
  "id": "tmua-2017-p2-q15",
  "revision": 1,
  "exam": "TMUA",
  "paperId": "tmua-2017-p2",
  "edition": "2017",
  "paper": 2,
  "questionNumber": 15,
  "sourceType": "past_paper",
  "contentStage": "extracted",
  "reviewStatus": "needs_review",
  "sourcePage": {
    "format": "pdf-layout-text",
    "rawText": "15     The function f is deﬁned on the positive integers as follows:\n\n                   f (1) = 5, and for n ⩾ 1:   f (n + 1) = 3f (n) + 1 if f (n) is odd\n                                               f (n + 1) = 12 f (n)   if f (n) is even\n\n        The function g is deﬁned on the positive integers as follows:\n\n                   g(1) = 3, and for n ⩾ 1:    g(n + 1) = g(n) + 5 if g(n) is odd\n                                               g(n + 1) = 12 g(n)  if g(n) is even\n\n\n        What is the value of f (1000) − g(1000)?\n\n        A −6\n\n        B −5\n\n        C 1\n\n        D 2\n\n        E      4\n\n        F      8\n\n\n\n\n\u00038&/(6\u0003\u0015\u0013\u0014\u001a                                    \u0014\u001a                                       >7XUQ\u0003RYHU"
  },
  "stem": {
    "format": "pdf-layout-text",
    "rawText": "The function f is deﬁned on the positive integers as follows:\n\n                   f (1) = 5, and for n ⩾ 1:   f (n + 1) = 3f (n) + 1 if f (n) is odd\n                                               f (n + 1) = 12 f (n)   if f (n) is even\n\n        The function g is deﬁned on the positive integers as follows:\n\n                   g(1) = 3, and for n ⩾ 1:    g(n + 1) = g(n) + 5 if g(n) is odd\n                                               g(n + 1) = 12 g(n)  if g(n) is even\n\n\n        What is the value of f (1000) − g(1000)?"
  },
  "options": [
    {
      "label": "A",
      "rawText": "−6"
    },
    {
      "label": "B",
      "rawText": "−5"
    },
    {
      "label": "C",
      "rawText": "1"
    },
    {
      "label": "D",
      "rawText": "2"
    },
    {
      "label": "E",
      "rawText": "4"
    },
    {
      "label": "F",
      "rawText": "8\n\n\n\n\n8&/(6                                                                           >7XUQRYHU"
    }
  ],
  "correctAnswer": "D",
  "solution": {
    "format": "pdf-layout-text",
    "rawText": "From the question, it seems that we are expected to work out the first few values of the functions\nf(n) and g(n), and to look for a pattern.\n\n                                           n f(n) g(n)\n                                           1 5     3\n                                           2 16    8\n                                           3 8     4\n                                           4 4     2\n                                           5 2     1\n                                           6 1     6\n                                           7 4     3\n                                           8 2     8\n                                           9 1     4\n                                          10 4     2\n                                          11 2     1\n                                          12 1     6\n\nSo after the first three terms, f(n) repeats every 3 terms: for k ⩾ 1, f(3k + 1) = 4, f(3k + 2) = 2,\nf(3k+3) = 1, while g(n) repeats every 6 terms, and we can write similar expressions for g(6k+r).\nWe could either calculate f(n) − g(n) for all of these terms, and find the repeating pattern there,\nor find f(1000) and g(1000) separately. The latter approach seems like less effort, so we will go\nfor that.\nNote that 1000 = 3 × 333 + 1 = 6 × 166 + 4. So f(1000) = 4, g(1000) = 2.\nThus f(1000) − g(1000) = 4 − 2 = 2 and the answer is D.\n\n\n\n\nVersion 1.0, April 2019                                                                     Page 17\n\n                                                                                       © UCLES 2019"
  },
  "sourceRefs": [
    {
      "role": "question",
      "sourceId": "tmua-official-2017-paper-2",
      "portablePath": "Tmua/2016-2023paper/tmua-paper-2-2017.pdf",
      "sha256": "c24b42792763f609f2eb98e9cc9ee2bcb8088b85a5dbf590832407f6f2e76bb7",
      "pages": [
        17
      ]
    },
    {
      "role": "answer_key",
      "sourceId": "tmua-official-2017-answer-key",
      "portablePath": "Tmua/2016-2023 answer key/tmua-2017.pdf",
      "sha256": "0094db54c8a7cd81e1161c9beabb59a9599f047fdce0923c620aa2271ee7b687",
      "pages": [
        1
      ]
    },
    {
      "role": "worked_solution",
      "sourceId": "tmua-official-2017-paper-2-worked-solutions",
      "portablePath": "Tmua/2016-2023 answer/tmua-paper-2-2017.pdf",
      "sha256": "84b2bb0bb4cd261dd56ac3e68ca45a1b57b2860c01c7c9c4228ed4d87754d54b",
      "pages": [
        18
      ]
    }
  ],
  "knowledgeTags": [],
  "skillTags": [],
  "errorTypes": [],
  "extraction": {
    "generatedAt": "2026-07-17T07:00:00.000Z",
    "generatedBy": "tmua-extraction-cli",
    "method": "poppler-layout-text",
    "mathFidelity": "needs_review",
    "warnings": [
      "math-transcription-required"
    ]
  }
}
